{
  "schemaVersion": "1.0.0",
  "taskId": "TASK-M0A-005",
  "revision": 1,
  "status": "draft",
  "changeId": "CHG-2026-001-macos-m0a",
  "changeRevision": 1,
  "approvalId": null,
  "coreBaseline": {
    "id": "CORE",
    "version": "1.0.0",
    "sha256": null
  },
  "platformProfile": {
    "id": "PLATFORM-MACOS",
    "version": "0.1.0",
    "sha256": "54bd9b295799cb8d93bf397eeb585f24828463f4f1fce1e59a0693f65369d0bf"
  },
  "integrationProfiles": [
    {
      "id": "OPENHARMONY-TOOLS",
      "version": "0.1.0",
      "sha256": "679874cf44234a00b7e5d8f920e81c6b52ff489df2a2c8dd6f03b540c87a11e1"
    }
  ],
  "conformanceSuite": {
    "id": "CORE-CONFORMANCE-1.0.0",
    "sha256": "2e5a51bf78afc2e15a8cd989c9381fcc2ac2b7cce370c2bc545767df06419aa2"
  },
  "baseRevision": null,
  "platform": "macos",
  "objective": "Build the Sandbox/non-Sandbox prototypes, execute the host and clean-VM trust matrix, and freeze the exact read-only hardware-lab handoff plan.",
  "requirementRefs": [
    "POL-SAFETY-001",
    "REQ-HDC-001",
    "REQ-HDC-003",
    "REQ-HDC-006",
    "PORT-FILE-ACCESS-001",
    "PORT-TOOL-TRUST-001",
    "PLATFORM-MACOS@0.1.0"
  ],
  "acceptanceRefs": [
    "AC-HDC-001-01",
    "AC-HDC-003-01",
    "AC-HDC-003-02",
    "AC-HDC-006-01",
    "MAC-M0A-TRUST-001",
    "MAC-M0A-TRUST-002",
    "MAC-M0A-TRUST-003",
    "MAC-M0A-TRUST-004"
  ],
  "dependsOn": [
    "TASK-M0A-001",
    "TASK-M0A-002",
    "TASK-M0A-003"
  ],
  "allowedPaths": [
    "ArkDeck.xcodeproj/**",
    "ArkDeckApp/**",
    "Configurations/**",
    "docs/adr/**",
    "openspec/changes/chg-2026-001-macos-m0a/evidence/**"
  ],
  "forbiddenPaths": [
    "openspec/constitution.md",
    "openspec/specs/**",
    "openspec/contracts/**",
    "openspec/baselines/**",
    "external-tools/**"
  ],
  "exclusiveResources": [
    "arkdeck-resource:vm-snapshot:clean-macos-m0a",
    "arkdeck-resource:fixture:quarantined-hdc-m0a",
    "arkdeck-resource:hdc-server:m0a-trust-matrix",
    "arkdeck-resource:host-volume:m0a-trust-output"
  ],
  "risk": "high",
  "executionEnvironment": "standardAgent",
  "runtimeCapabilities": [
    "repositoryProcess",
    "externalToolExecution",
    "deviceNetworkAccess",
    "externalFilesystemWrite"
  ],
  "hardwareRequirement": "none",
  "deliverables": [
    "Sandboxed and non-Sandbox signed prototypes with actual entitlement dumps.",
    "Clean-VM Gatekeeper/quarantine matrix for DevEco, downloaded and no-quarantine HDC controls.",
    "Canonical, hashable read-only USB/UART/TCP lab plan and target prerequisites for TASK-M0A-007; this Task does not claim real-hardware evidence."
  ],
  "verification": [
    {
      "acceptanceId": "AC-HDC-001-01",
      "testId": "TEST-AC-HDC-001-01",
      "method": "toolchainContract",
      "expectedEvidence": "The chosen absolute path/hash/version/endpoint remains fixed for the Job.",
      "minimumEvidence": "contract",
      "fixtureRefs": []
    },
    {
      "acceptanceId": "AC-HDC-003-01",
      "testId": "TEST-AC-HDC-003-01",
      "method": "lifecycleCallCounter",
      "expectedEvidence": "The server remains external and automatic stop/restart calls are zero.",
      "minimumEvidence": "contract",
      "fixtureRefs": []
    },
    {
      "acceptanceId": "AC-HDC-003-02",
      "testId": "TEST-AC-HDC-003-02",
      "method": "ownershipEvidenceContract",
      "expectedEvidence": "Managed ownership is assigned only with PID/path/endpoint evidence.",
      "minimumEvidence": "contract",
      "fixtureRefs": []
    },
    {
      "acceptanceId": "AC-HDC-006-01",
      "testId": "TEST-AC-HDC-006-01",
      "method": "platformFileAccessContract",
      "expectedEvidence": "A diagnostic error is shown; no key deletion, home reset or server restart occurs.",
      "minimumEvidence": "platform",
      "fixtureRefs": []
    },
    {
      "acceptanceId": "MAC-M0A-TRUST-001",
      "testId": "TEST-MAC-M0A-TRUST-001",
      "method": "Clean-VM HDC provenance/path/key/server/file matrix.",
      "expectedEvidence": "Every matrix cell records pass, fail or blocked with the exact tool hash and diagnostic classification.",
      "minimumEvidence": "platform",
      "fixtureRefs": []
    },
    {
      "acceptanceId": "MAC-M0A-TRUST-002",
      "testId": "TEST-MAC-M0A-TRUST-002",
      "method": "Clean-VM execution of quarantined downloaded HDC.",
      "expectedEvidence": "Blocked and user-allowed outcomes are distinguished, with exact non-bypass guidance and system evidence.",
      "minimumEvidence": "platform",
      "fixtureRefs": []
    },
    {
      "acceptanceId": "MAC-M0A-TRUST-003",
      "testId": "TEST-MAC-M0A-TRUST-003",
      "method": "Bit-identical no-quarantine control.",
      "expectedEvidence": "The result distinguishes Gatekeeper/quarantine from Sandbox/file-access failures.",
      "minimumEvidence": "platform",
      "fixtureRefs": []
    },
    {
      "acceptanceId": "MAC-M0A-TRUST-004",
      "testId": "TEST-MAC-M0A-TRUST-004",
      "method": "Safari download and Archive Utility extraction on restored VM.",
      "expectedEvidence": "Quarantine propagation and resulting assessment are captured without changing xattrs.",
      "minimumEvidence": "platform",
      "fixtureRefs": []
    }
  ],
  "stopConditions": [
    "A scenario requires ArkDeck to remove quarantine, re-sign a tool, copy/delete a private key or disable system security.",
    "The clean VM snapshot or exact HDC fixture is unavailable.",
    "A new entitlement or distribution exception is required but not approved in the platform change."
  ]
}
